{
  "$schema": "http://json-schema.org/draft-04/schema#",
  "description": "",
  "type": "object",
  "properties": {
    "access_token": {
      "type": "string",
      "minLength": 1
    },
    "expires_in": {
      "type": "number"
    },
    "refresh_expires_in": {
      "type": "number"
    },
    "refresh_token": {
      "type": "string",
      "minLength": 1
    },
    "token_type": {
      "type": "string",
      "minLength": 1
    },
    "not-before-policy": {
      "type": "number"
    },
    "session_state": {
      "type": "string",
      "minLength": 1
    },
    "scope": {
      "type": "string",
      "minLength": 1
    }
  },
  "required": [
    "access_token",
    "expires_in",
    "refresh_expires_in",
    "refresh_token",
    "token_type",
    "not-before-policy",
    "session_state",
    "scope"
  ]
}