{
  "access_token": "eyJhbGciOiJSUzI1NiIsInR5cCIgOiAiSldUIiwia2lkIiA6ICJuOGlYX0tZZDM0OXFvX01jYmhHbUtWU0ZPbDFMQzJremh3WUI2bzI1eVNNIn0.eyJleHAiOjE1OTM3NTk3MDIsImlhdCI6MTU5Mzc1OTY0MiwiYXV0aF90aW1lIjoxNTkzNzU4NDE1LCJqdGkiOiI1YmFlY2QwNy0xMWFhLTQ1Y2UtYjFmMS03ZTJlYjE1MWE4YTYiLCJpc3MiOiJodHRwOi8vbG9jYWxob3N0OjgwODEvYXV0aC9yZWFsbXMvbWFzdGVyIiwiYXVkIjpbIm1hc3Rlci1yZWFsbSIsImFjY291bnQiXSwic3ViIjoiNWM5ZjNmYTctYmVmMS00MDVjLWIwNzUtYmMzNTQ0NDI3YWExIiwidHlwIjoiQmVhcmVyIiwiYXpwIjoic2VhbnMtY2xpZW50Iiwic2Vzc2lvbl9zdGF0ZSI6IjkxMTRmY2ZjLWI3MDQtNGNkMS04OTFhLTU2MDcwODQ3NjZmNCIsImFjciI6IjAiLCJyZWFsbV9hY2Nlc3MiOnsicm9sZXMiOlsiY3JlYXRlLXJlYWxtIiwib2ZmbGluZV9hY2Nlc3MiLCJhZG1pbiIsInVtYV9hdXRob3JpemF0aW9uIl19LCJyZXNvdXJjZV9hY2Nlc3MiOnsibWFzdGVyLXJlYWxtIjp7InJvbGVzIjpbInZpZXctaWRlbnRpdHktcHJvdmlkZXJzIiwidmlldy1yZWFsbSIsIm1hbmFnZS1pZGVudGl0eS1wcm92aWRlcnMiLCJpbXBlcnNvbmF0aW9uIiwiY3JlYXRlLWNsaWVudCIsIm1hbmFnZS11c2VycyIsInF1ZXJ5LXJlYWxtcyIsInZpZXctYXV0aG9yaXphdGlvbiIsInF1ZXJ5LWNsaWVudHMiLCJxdWVyeS11c2VycyIsIm1hbmFnZS1ldmVudHMiLCJtYW5hZ2UtcmVhbG0iLCJ2aWV3LWV2ZW50cyIsInZpZXctdXNlcnMiLCJ2aWV3LWNsaWVudHMiLCJtYW5hZ2UtYXV0aG9yaXphdGlvbiIsIm1hbmFnZS1jbGllbnRzIiwicXVlcnktZ3JvdXBzIl19LCJhY2NvdW50Ijp7InJvbGVzIjpbIm1hbmFnZS1hY2NvdW50IiwibWFuYWdlLWFjY291bnQtbGlua3MiLCJ2aWV3LXByb2ZpbGUiXX19LCJzY29wZSI6InByb2ZpbGUgZW1haWwiLCJlbWFpbF92ZXJpZmllZCI6ZmFsc2UsInByZWZlcnJlZF91c2VybmFtZSI6ImFkbWluIn0.JpNdL1_uqGhez7kPDNIx1V7S5ZXHpHnMF_7k8unw5_fzoAKwzXwc6Xt7kMgwt9VTwUYyNNGXN4dTLGsN9BeTm_il_NCZy7UNYtAmKM7CdneRA8PSGVNyQhrGyXmnPlC3oCa8QXNcRTAvXLfhYFCayBix3musie3wtUbuICSB6GLbGsriPdlsv6DrJUkLOPa9l-OV8_fVRcgVU9m1yj6Up4NU6owwFyvQx5B9f_RmiCQ_B0zeQBN5SRKBpKBUPLYztUgyk0lmbtGsiOaclqdfQzWY9ejxhTlbSHJpxsuzAl8AhijIji3SgLcpYBwSkAQL2i3n8m6FcjRteWLWQXFzVQ",
  "expires_in": 60,
  "refresh_expires_in": 1800,
  "refresh_token": "eyJhbGciOiJIUzI1NiIsInR5cCIgOiAiSldUIiwia2lkIiA6ICI1YTZkNzIxYS04MzJjLTRiMGQtOTkwZC1lZmE2ZTFhMjdlODIifQ.eyJleHAiOjE1OTM3NjE0NDIsImlhdCI6MTU5Mzc1OTY0MiwianRpIjoiYmQ3ZTZjOGYtZTMzZS00N2VkLTk2YjItM2I1MTk2ZjQyZjE4IiwiaXNzIjoiaHR0cDovL2xvY2FsaG9zdDo4MDgxL2F1dGgvcmVhbG1zL21hc3RlciIsImF1ZCI6Imh0dHA6Ly9sb2NhbGhvc3Q6ODA4MS9hdXRoL3JlYWxtcy9tYXN0ZXIiLCJzdWIiOiI1YzlmM2ZhNy1iZWYxLTQwNWMtYjA3NS1iYzM1NDQ0MjdhYTEiLCJ0eXAiOiJSZWZyZXNoIiwiYXpwIjoic2VhbnMtY2xpZW50Iiwic2Vzc2lvbl9zdGF0ZSI6IjkxMTRmY2ZjLWI3MDQtNGNkMS04OTFhLTU2MDcwODQ3NjZmNCIsInNjb3BlIjoicHJvZmlsZSBlbWFpbCJ9.MEPP-vIJrO4uDlQ0NH1dYaxuAPwhqx2lF8ypu25F5mA",
  "token_type": "bearer",
  "not-before-policy": 0,
  "session_state": "9114fcfc-b704-4cd1-891a-5607084766f4",
  "scope": "profile email"
}
