{
  "access_token": "eyJhbGciOiJSUzI1NiIsInR5cCIgOiAiSldUIiwia2lkIiA6ICJuOGlYX0tZZDM0OXFvX01jYmhHbUtWU0ZPbDFMQzJremh3WUI2bzI1eVNNIn0.eyJleHAiOjE1OTM3NTk1NTUsImlhdCI6MTU5Mzc1OTQ5NSwianRpIjoiNmI0M2NjM2YtMTdjYS00YjVjLWI5NzAtNmZjMmYwMWQ0MWI5IiwiaXNzIjoiaHR0cDovL2xvY2FsaG9zdDo4MDgxL2F1dGgvcmVhbG1zL21hc3RlciIsImF1ZCI6ImFjY291bnQiLCJzdWIiOiI2MGI1ZDc4Ny02NmJmLTQ0ODAtYjcyYi0yOTI1M2JjOWI3NzgiLCJ0eXAiOiJCZWFyZXIiLCJhenAiOiJzZWFucy1jbGllbnQiLCJzZXNzaW9uX3N0YXRlIjoiYzEyNjBjNGQtMDg1ZS00ZmFkLTkzYWItODUwNTMwYmZjZDQ2IiwiYWNyIjoiMSIsInJlYWxtX2FjY2VzcyI6eyJyb2xlcyI6WyJvZmZsaW5lX2FjY2VzcyIsInVtYV9hdXRob3JpemF0aW9uIl19LCJyZXNvdXJjZV9hY2Nlc3MiOnsiYWNjb3VudCI6eyJyb2xlcyI6WyJtYW5hZ2UtYWNjb3VudCIsIm1hbmFnZS1hY2NvdW50LWxpbmtzIiwidmlldy1wcm9maWxlIl19fSwic2NvcGUiOiJwcm9maWxlIGVtYWlsIiwiZW1haWxfdmVyaWZpZWQiOmZhbHNlLCJwcmVmZXJyZWRfdXNlcm5hbWUiOiJzb21lb25lIn0.XD3hpludO7T7MU249G5lxLnO_JocPB_HRyJ9_Z3pvNWmhll2uvEOqx4wjqWHzDQ_MGZLWmziZ7MJDyvDoLXQKDy7mtF0b36Piz9MRldP-I7W_mG9W4gG83x-Yd2GqM9hPrBbfZ3E8f9tRr7LQKflO-y9z2XMMj8HVnfzjY5P2g13jBBiYZgLf7yM5vr9kmBZwX2YLfwjuQDWFGinQ0Rq0lIt8JBS5wifIQ_XiV61rOmqNXCJgZ3oUqMWu68kIpkOtZuKmQcHrtylATgEP_hrTk7GB2yjdk1ond19JLPU5A4899q1wHBtReFPnJsoMQn9EiZTFoueopJLSzRVN7e05w",
  "expires_in": 60,
  "refresh_expires_in": 1800,
  "refresh_token": "eyJhbGciOiJIUzI1NiIsInR5cCIgOiAiSldUIiwia2lkIiA6ICI1YTZkNzIxYS04MzJjLTRiMGQtOTkwZC1lZmE2ZTFhMjdlODIifQ.eyJleHAiOjE1OTM3NjEyOTUsImlhdCI6MTU5Mzc1OTQ5NSwianRpIjoiZTEyYTk2N2UtZWRkMi00MzExLWFlODUtMmE4N2M5ZTJiOWU2IiwiaXNzIjoiaHR0cDovL2xvY2FsaG9zdDo4MDgxL2F1dGgvcmVhbG1zL21hc3RlciIsImF1ZCI6Imh0dHA6Ly9sb2NhbGhvc3Q6ODA4MS9hdXRoL3JlYWxtcy9tYXN0ZXIiLCJzdWIiOiI2MGI1ZDc4Ny02NmJmLTQ0ODAtYjcyYi0yOTI1M2JjOWI3NzgiLCJ0eXAiOiJSZWZyZXNoIiwiYXpwIjoic2VhbnMtY2xpZW50Iiwic2Vzc2lvbl9zdGF0ZSI6ImMxMjYwYzRkLTA4NWUtNGZhZC05M2FiLTg1MDUzMGJmY2Q0NiIsInNjb3BlIjoicHJvZmlsZSBlbWFpbCJ9.0XW6yQWCaIx8mAE4qK9iLHXk01_0nsMjGgWW2brtUL8",
  "token_type": "bearer",
  "not-before-policy": 0,
  "session_state": "c1260c4d-085e-4fad-93ab-850530bfcd46",
  "scope": "profile email"
}

