{
  "access_token": "eyJhbGciOiJSUzI1NiIsInR5cCIgOiAiSldUIiwia2lkIiA6ICJuOGlYX0tZZDM0OXFvX01jYmhHbUtWU0ZPbDFMQzJremh3WUI2bzI1eVNNIn0.eyJleHAiOjE1OTM3NTg4MTcsImlhdCI6MTU5Mzc1ODc1NywianRpIjoiMGI5MmE5ZTUtMTZjZS00ZjA2LWEwYjctZGYyNWU3NTY3MWYzIiwiaXNzIjoiaHR0cDovL2xvY2FsaG9zdDo4MDgxL2F1dGgvcmVhbG1zL21hc3RlciIsInN1YiI6IjVjOWYzZmE3LWJlZjEtNDA1Yy1iMDc1LWJjMzU0NDQyN2FhMSIsInR5cCI6IkJlYXJlciIsImF6cCI6ImFkbWluLWNsaSIsInNlc3Npb25fc3RhdGUiOiI4NmRjODM4YS1kOTZkLTQ1MWItODJjZS1iODIyMWMxMDY2Y2IiLCJhY3IiOiIxIiwic2NvcGUiOiJwcm9maWxlIGVtYWlsIiwiZW1haWxfdmVyaWZpZWQiOmZhbHNlLCJwcmVmZXJyZWRfdXNlcm5hbWUiOiJhZG1pbiJ9.Q5Q7vkuCgAU22A78TiRTNbB2lVlSf-yKBHNhAAtipfFssZ0NWmoR7YkMVWVHXD2zQK0caT0bXtkbRu7UHjnHpzOXUq60YEnngjbEKJDd485g9ngh4dYxGqlVdBrtRAEfn0HPM-BC9zfB_LmQEdH7D_BV0TMxR1Aef_IaegN0xtROs8YxIc4_eriKc14JG-4q79DlPDzgTG5KxSQhexlpIoJKj1ki908xt2HN4OjbIXEcIy1ACyKbhtEnA-mHhxDZ_gAoTxHZSx8B_mOWlMGm3M8H8yogNwBJH_rSTKXHubs6gD0U6aNkfKBYzm5IxFQ6rz7xmQDETrKPV191wscBuw",
  "expires_in": 60,
  "refresh_expires_in": 1800,
  "refresh_token": "eyJhbGciOiJIUzI1NiIsInR5cCIgOiAiSldUIiwia2lkIiA6ICI1YTZkNzIxYS04MzJjLTRiMGQtOTkwZC1lZmE2ZTFhMjdlODIifQ.eyJleHAiOjE1OTM3NjA1NTcsImlhdCI6MTU5Mzc1ODc1NywianRpIjoiZDE0MTQ3NGEtMWFjNy00ZWEwLTgwNTAtODUwOTBiZDcyYTNjIiwiaXNzIjoiaHR0cDovL2xvY2FsaG9zdDo4MDgxL2F1dGgvcmVhbG1zL21hc3RlciIsImF1ZCI6Imh0dHA6Ly9sb2NhbGhvc3Q6ODA4MS9hdXRoL3JlYWxtcy9tYXN0ZXIiLCJzdWIiOiI1YzlmM2ZhNy1iZWYxLTQwNWMtYjA3NS1iYzM1NDQ0MjdhYTEiLCJ0eXAiOiJSZWZyZXNoIiwiYXpwIjoiYWRtaW4tY2xpIiwic2Vzc2lvbl9zdGF0ZSI6Ijg2ZGM4MzhhLWQ5NmQtNDUxYi04MmNlLWI4MjIxYzEwNjZjYiIsInNjb3BlIjoicHJvZmlsZSBlbWFpbCJ9.co3xfxjjLShchUdabGf4TRLhsy0QdmEmbIGgO0NvZCc",
  "token_type": "bearer",
  "not-before-policy": 0,
  "session_state": "86dc838a-d96d-451b-82ce-b8221c1066cb",
  "scope": "profile email"
}
