{
  "access_token": "eyJhbGciOiJSUzI1NiIsInR5cCIgOiAiSldUIiwia2lkIiA6ICJuOGlYX0tZZDM0OXFvX01jYmhHbUtWU0ZPbDFMQzJremh3WUI2bzI1eVNNIn0.eyJleHAiOjE1OTM3NTkzMjQsImlhdCI6MTU5Mzc1OTI2NCwianRpIjoiZDAwMmJjYTEtODFjYy00MzBjLWE2ZDctNjUxZTZlMjEyNzNiIiwiaXNzIjoiaHR0cDovL2xvY2FsaG9zdDo4MDgxL2F1dGgvcmVhbG1zL21hc3RlciIsImF1ZCI6ImFjY291bnQiLCJzdWIiOiJhYTBhZTc4OC1jYjEwLTQ0OTEtYTg2ZS1jOWJjZmUzOWRhMTQiLCJ0eXAiOiJCZWFyZXIiLCJhenAiOiJzZWFucy1jbGllbnQiLCJzZXNzaW9uX3N0YXRlIjoiNWI1NjU4ZjUtZjI4Zi00MjQyLWI1NDYtYjljYzBjNzBkOGE2IiwiYWNyIjoiMSIsInJlYWxtX2FjY2VzcyI6eyJyb2xlcyI6WyJvZmZsaW5lX2FjY2VzcyIsInVtYV9hdXRob3JpemF0aW9uIl19LCJyZXNvdXJjZV9hY2Nlc3MiOnsic2VhbnMtY2xpZW50Ijp7InJvbGVzIjpbInVtYV9wcm90ZWN0aW9uIl19LCJhY2NvdW50Ijp7InJvbGVzIjpbIm1hbmFnZS1hY2NvdW50IiwibWFuYWdlLWFjY291bnQtbGlua3MiLCJ2aWV3LXByb2ZpbGUiXX19LCJzY29wZSI6InByb2ZpbGUgZW1haWwiLCJjbGllbnRJZCI6InNlYW5zLWNsaWVudCIsImVtYWlsX3ZlcmlmaWVkIjpmYWxzZSwiY2xpZW50SG9zdCI6IjE5Mi4xNjguOS4xIiwicHJlZmVycmVkX3VzZXJuYW1lIjoic2VydmljZS1hY2NvdW50LXNlYW5zLWNsaWVudCIsImNsaWVudEFkZHJlc3MiOiIxOTIuMTY4LjkuMSJ9.BXA_5WhcNlO4Hv_grmNlKFhUfOa57m-1hSMyVrvyn58bhB7tZCoiLsL4BrVttdbKmzKVSjifMqr8mUDT21nu_pqSCgJ45WnjMobg8TX6Ysae0WaXI1gKH4Dm_EZXigdcpsV9EjXp7HFKA38-P1eOruU9OjXgY-X0dJW9yl6PRBRbp2mO_NBE88Igkt3nuDCBcbhiXN0bKYn0Fh4xbHIyeSIwuHt5dfZgdm93dLRtTc5DtzHb_oKEqJvbOS5dtP4XatykI92yYe-xDtbyuuCvPoowYNcP4wy09XYWsqOoYucFefMMPehto0Y0LHIjRQbB4gW9IQhOBtOk5HstEn5H4g",
  "expires_in": 60,
  "refresh_expires_in": 1800,
  "refresh_token": "eyJhbGciOiJIUzI1NiIsInR5cCIgOiAiSldUIiwia2lkIiA6ICI1YTZkNzIxYS04MzJjLTRiMGQtOTkwZC1lZmE2ZTFhMjdlODIifQ.eyJleHAiOjE1OTM3NjEwNjQsImlhdCI6MTU5Mzc1OTI2NCwianRpIjoiM2UxZDhmYTEtYWJmYi00MjZlLTkzODgtYjc3OTRhZGM2MDJiIiwiaXNzIjoiaHR0cDovL2xvY2FsaG9zdDo4MDgxL2F1dGgvcmVhbG1zL21hc3RlciIsImF1ZCI6Imh0dHA6Ly9sb2NhbGhvc3Q6ODA4MS9hdXRoL3JlYWxtcy9tYXN0ZXIiLCJzdWIiOiJhYTBhZTc4OC1jYjEwLTQ0OTEtYTg2ZS1jOWJjZmUzOWRhMTQiLCJ0eXAiOiJSZWZyZXNoIiwiYXpwIjoic2VhbnMtY2xpZW50Iiwic2Vzc2lvbl9zdGF0ZSI6IjViNTY1OGY1LWYyOGYtNDI0Mi1iNTQ2LWI5Y2MwYzcwZDhhNiIsInNjb3BlIjoicHJvZmlsZSBlbWFpbCJ9.VSa_fLlnUIyw03y0Wg1Qv_5LVIxEkhojsolHsneb28w",
  "token_type": "bearer",
  "not-before-policy": 0,
  "session_state": "5b5658f5-f28f-4242-b546-b9cc0c70d8a6",
  "scope": "profile email"
}
